{
  "schemaVersion": "1.0",
  "taskId": "task_a828a62709a8",
  "source": "pipeline",
  "objects": [
    {
      "id": "building_001",
      "category": "building",
      "anchor": {
        "type": "bottom_center",
        "position": [
          46.56822330200235,
          -33.7528631459161,
          112.32877229243215
        ]
      },
      "dimensions": {
        "width": 11.766253187919432,
        "height": 44.97697617062243,
        "length": 23.739277307177495,
        "unit": "relative"
      },
      "rotation": {
        "yaw": -112.65363984990785,
        "unit": "degree"
      },
      "source": {
        "bbox": [
          1218,
          102,
          1440,
          500
        ],
        "maskPath": "/home/ai3d/outputs/scene-spatial/task_a828a62709a8/detection/raw/masks/building_001.png"
      },
      "confidence": {
        "category": 0.91796875,
        "detection": 0.91796875,
        "mask": 0.8,
        "position": 0.95,
        "dimensions": 0.95,
        "rotation": 0.95
      }
    },
    {
      "id": "building_002",
      "category": "building",
      "anchor": {
        "type": "bottom_center",
        "position": [
          -13.771250748675076,
          -46.71725990071067,
          154.35093299486647
        ]
      },
      "dimensions": {
        "width": 8.876646209122155,
        "height": 35.56167581420503,
        "length": 75.10789472877308,
        "unit": "relative"
      },
      "rotation": {
        "yaw": 8.122034178293191,
        "unit": "degree"
      },
      "source": {
        "bbox": [
          842,
          176,
          892,
          363
        ],
        "maskPath": "/home/ai3d/outputs/scene-spatial/task_a828a62709a8/detection/raw/masks/building_002.png"
      },
      "confidence": {
        "category": 0.8828125,
        "detection": 0.8828125,
        "mask": 0.8,
        "position": 0.95,
        "dimensions": 0.95,
        "rotation": 0.95
      }
    },
    {
      "id": "building_003",
      "category": "building",
      "anchor": {
        "type": "bottom_center",
        "position": [
          21.985906854469384,
          -49.725779961267,
          164.8169796177617
        ]
      },
      "dimensions": {
        "width": 10.079598919781548,
        "height": 35.268966133331126,
        "length": 79.18842378985943,
        "unit": "relative"
      },
      "rotation": {
        "yaw": 179.259698006572,
        "unit": "degree"
      },
      "source": {
        "bbox": [
          1035,
          178,
          1091,
          386
        ],
        "maskPath": "/home/ai3d/outputs/scene-spatial/task_a828a62709a8/detection/raw/masks/building_003.png"
      },
      "confidence": {
        "category": 0.86328125,
        "detection": 0.86328125,
        "mask": 0.8,
        "position": 0.95,
        "dimensions": 0.95,
        "rotation": 0.95
      }
    },
    {
      "id": "building_004",
      "category": "building",
      "anchor": {
        "type": "bottom_center",
        "position": [
          -34.36731590397841,
          -155.30869651035763,
          513.2941846573794
        ]
      },
      "dimensions": {
        "width": 20.637047356054925,
        "height": 38.08216448841435,
        "length": 630.4062939521089,
        "unit": "relative"
      },
      "rotation": {
        "yaw": 2.9060612571094873,
        "unit": "degree"
      },
      "source": {
        "bbox": [
          881,
          155,
          913,
          229
        ],
        "maskPath": "/home/ai3d/outputs/scene-spatial/task_a828a62709a8/detection/raw/masks/building_004.png"
      },
      "confidence": {
        "category": 0.8515625,
        "detection": 0.8515625,
        "mask": 0.8,
        "position": 0.95,
        "dimensions": 0.95,
        "rotation": 0.95
      }
    },
    {
      "id": "building_005",
      "category": "building",
      "anchor": {
        "type": "bottom_center",
        "position": [
          -132.55279344305575,
          -106.66861357843364,
          350.97491001314893
        ]
      },
      "dimensions": {
        "width": 33.31491677867982,
        "height": 50.33464817692563,
        "length": 57.17844449533197,
        "unit": "relative"
      },
      "rotation": {
        "yaw": -169.75707715203157,
        "unit": "degree"
      },
      "source": {
        "bbox": [
          562,
          120,
          667,
          282
        ],
        "maskPath": "/home/ai3d/outputs/scene-spatial/task_a828a62709a8/detection/raw/masks/building_005.png"
      },
      "confidence": {
        "category": 0.84765625,
        "detection": 0.84765625,
        "mask": 0.8,
        "position": 0.95,
        "dimensions": 0.95,
        "rotation": 0.95
      }
    },
    {
      "id": "building_006",
      "category": "building",
      "anchor": {
        "type": "bottom_center",
        "position": [
          -4.903998262271108,
          -60.30627364417721,
          199.4330050274796
        ]
      },
      "dimensions": {
        "width": 8.373898864693473,
        "height": 36.27707493690126,
        "length": 26.91031559632296,
        "unit": "relative"
      },
      "rotation": {
        "yaw": 6.205067666705982,
        "unit": "degree"
      },
      "source": {
        "bbox": [
          914,
          175,
          957,
          246
        ],
        "maskPath": "/home/ai3d/outputs/scene-spatial/task_a828a62709a8/detection/raw/masks/building_006.png"
      },
      "confidence": {
        "category": 0.8359375,
        "detection": 0.8359375,
        "mask": 0.8,
        "position": 0.95,
        "dimensions": 0.95,
        "rotation": 0.95
      }
    },
    {
      "id": "building_007",
      "category": "building",
      "anchor": {
        "type": "bottom_center",
        "position": [
          7.391790789877446,
          -55.99130685182865,
          185.3348865328332
        ]
      },
      "dimensions": {
        "width": 11.21060293559286,
        "height": 38.30056377617456,
        "length": 15.503679229002813,
        "unit": "relative"
      },
      "rotation": {
        "yaw": -163.01036559344143,
        "unit": "degree"
      },
      "source": {
        "bbox": [
          957,
          164,
          1021,
          246
        ],
        "maskPath": "/home/ai3d/outputs/scene-spatial/task_a828a62709a8/detection/raw/masks/building_007.png"
      },
      "confidence": {
        "category": 0.8359375,
        "detection": 0.8359375,
        "mask": 0.8,
        "position": 0.95,
        "dimensions": 0.95,
        "rotation": 0.95
      }
    },
    {
      "id": "building_008",
      "category": "building",
      "anchor": {
        "type": "bottom_center",
        "position": [
          -241.5403158005582,
          -71.14568668004159,
          231.89433795105754
        ]
      },
      "dimensions": {
        "width": 7.163879188218402,
        "height": 41.71140115260886,
        "length": 16.769878945813105,
        "unit": "relative"
      },
      "rotation": {
        "yaw": -164.42552724228065,
        "unit": "degree"
      },
      "source": {
        "bbox": [
          0,
          130,
          50,
          327
        ],
        "maskPath": "/home/ai3d/outputs/scene-spatial/task_a828a62709a8/detection/raw/masks/building_008.png"
      },
      "confidence": {
        "category": 0.8203125,
        "detection": 0.8203125,
        "mask": 0.8,
        "position": 0.95,
        "dimensions": 0.95,
        "rotation": 0.95
      }
    },
    {
      "id": "building_009",
      "category": "building",
      "anchor": {
        "type": "bottom_center",
        "position": [
          -30.645211201604248,
          -33.76337360788907,
          111.25502162099828
        ]
      },
      "dimensions": {
        "width": 17.48953044104358,
        "height": 34.69763665706515,
        "length": 26.699934447588987,
        "unit": "relative"
      },
      "rotation": {
        "yaw": -168.20031513850503,
        "unit": "degree"
      },
      "source": {
        "bbox": [
          623,
          194,
          792,
          451
        ],
        "maskPath": "/home/ai3d/outputs/scene-spatial/task_a828a62709a8/detection/raw/masks/building_009.png"
      },
      "confidence": {
        "category": 0.81640625,
        "detection": 0.81640625,
        "mask": 0.8,
        "position": 0.95,
        "dimensions": 0.95,
        "rotation": 0.95
      }
    },
    {
      "id": "building_010",
      "category": "building",
      "anchor": {
        "type": "bottom_center",
        "position": [
          2.5013823608207373,
          -34.67782406362191,
          114.75605106755285
        ]
      },
      "dimensions": {
        "width": 3.2443600223629545,
        "height": 28.828846807153987,
        "length": 23.39010854763334,
        "unit": "relative"
      },
      "rotation": {
        "yaw": -83.64226551176444,
        "unit": "degree"
      },
      "source": {
        "bbox": [
          876,
          245,
          1071,
          400
        ],
        "maskPath": "/home/ai3d/outputs/scene-spatial/task_a828a62709a8/detection/raw/masks/building_010.png"
      },
      "confidence": {
        "category": 0.8125,
        "detection": 0.8125,
        "mask": 0.8,
        "position": 0.95,
        "dimensions": 0.95,
        "rotation": 0.95
      }
    },
    {
      "id": "building_011",
      "category": "building",
      "anchor": {
        "type": "bottom_center",
        "position": [
          39.88991967256797,
          -51.93680612034054,
          172.388470630675
        ]
      },
      "dimensions": {
        "width": 8.410441862360344,
        "height": 34.26478653969539,
        "length": 29.876272596365396,
        "unit": "relative"
      },
      "rotation": {
        "yaw": -168.07357847044761,
        "unit": "degree"
      },
      "source": {
        "bbox": [
          1124,
          179,
          1214,
          395
        ],